<?xml version="1.0" encoding="UTF-8"?>
<world-definition
    xmlns="http://www.vettalabs.com/petaverse"
    xmlns:xsi="http://www.w3.org/2001/XMLSchema-instance"
    xsi:schemaLocation="http://www.vettalabs.com/petaverse VirtualWorld.xsd">
    <entity-info>
        <entity-object name="petHome" type="object" noisy="false" small="false"
                       edible="false" movable="false" 
                       drinkable="false" pee_place="false" poo_place="false"
                       pickupable="false" 
                       moving="false"/>
        <entity-object name="water01" type="object" noisy="false" small="true"
                       edible="false" movable="false" 
                       drinkable="true" pee_place="false" poo_place="false"
                       pickupable="false" 
                       moving="false"/>
        <entity-object name="meat" type="object" noisy="false" small="true"
                       edible="true" movable="true" 
                       drinkable="false" pee_place="false" poo_place="false"
                       pickupable="true" 
                       moving="false"/>
        <entity-object name="stick" type="object" noisy="false" small="true"
                       edible="false" movable="true" 
                       drinkable="false" pee_place="false" poo_place="false"
                       pickupable="true" 
                       moving="false"/>
        <entity-object name="barrilPoo" type="object" noisy="false" small="false"
                       edible="false" movable="false" 
                       drinkable="false" pee_place="false" poo_place="true"
                       pickupable="false" 
                       moving="false"/>
        <entity-object name="barrilPee" type="object" noisy="false" small="false"
                       edible="false" movable="false" 
                       drinkable="false" pee_place="true" poo_place="false"
                       pickupable="false" 
                       moving="false"/>
                      
        <entity-object name="wynx" type="avatar" noisy="false" small="false"
                       edible="false" movable="false" 
                       drinkable="false" pee_place="false" poo_place="false"
                       pickupable="false" 
                       moving="true"/>

        <agent-object name="fido" type="pet" noisy="false" small="false"
                       edible="false" movable="true" 
                       drinkable="false" pee_place="false" poo_place="false"
                       pickupable="false" 
                       moving="false" novelty="false" learning="false"
                       askedToTry="false"
                       learnedTricks="false" requestedSchema="false">

            <thirst value="0.5"/>
            <hunger value="0.5"/>
            <energy value="0.5"/>
            <fitness value="0.5"/>
            <pee_urgency value="0.5"/>
            <poo_urgency value="0.5"/>
            
            <fear value="0.4"/>
            <hate value="0.5"/>
            <love value="0.5"/>
            <anger value="0.5"/>
            <pride value="0.5"/>
            <gratitude value="0.5"/>
            <happiness value="0.5"/>
            <excitement value="0.5"/>

            <!-- maxie -->
            <curiosity value="0.7"/>
            <playfulness value="0.1"/>
            <fearfulness value="0.8"/>
            <friendliness value="0.6"/>
            <excitability value="0.6"/>
            <aggressiveness value="0.1"/>
            <appreciativeness value="0.1"/>
        </agent-object>
    </entity-info>

    <indefinite-object-info>
        <nearest_object  value="stick"/> 
        <nearest_edible  value="meat"/> 
        <nearest_movable value="stick"/>
        <nearest_pickupable value="stick"/> 
        <nearest_drinkable  value="water01"/>
        <nearest_avatar value="wynx"/> 
        <nearest_pet    value=""/> 
        <nearest_small  value="stick"/>
        <nearest_moving value="wynx"/>
        <nearest_noisy  value=""/> 
        <nearest_friendly  value=""/>
        <nearest_poo_place value="barrilPoo"/>
        <nearest_pee_place value="barrilPee"/>
        
        <random_object  value="petHome"/>
        <random_edible  value="meat"/>
        <random_movable value="stick"/>
        <random_pickupable value="meat"/> 
        <random_drinkable  value="water01"/>
        <random_avatar value="wynx"/>
        <random_pet    value=""/> 
        <random_small  value="stick"/>
        <random_moving value="wynx"/>
        <random_noisy  value=""/>
        <random_friendly  value=""/>
        <random_poo_place value="barrilPoo"/>
        <random_pee_place value="barrilPee"/>

        <food_bowl  value="meat"/>
        <water_bowl value="water01"/>
        <pet_home   value="petHome"/>
        <pet_bowl   value="meat"/>
        <last_food_place value=""/>
        <exemplar_avatar value=""/>
    </indefinite-object-info>

    <world-state-info pet-id="fido" owner-id="wynx" pet-mode="PLAYING_MODE"
                      agent-state="0" action-repetition="0">
        <near-info>
            <near first="wynx" second="fido"/>
            <near first="fido" second="wynx"/>
            <near first="fido" second="barrilPoo"/>
        </near-info>

        <next-info>
            <next first="wynx" second="fido"/>
            <next first="fido" second="wynx"/>
            <next first="fido" second="barrilPoo"/>
            <next first="fido" second="stick"/>
            <next first="stick" second="barrilPee"/>
        </next-info>

        <owner-info>
            <owns first="wynx" second="fido"/> 
        </owner-info>

        <moving-toward-info>
            <moving-toward first="wynx" second="fido"/>
        </moving-toward-info>

        <inside-fov-info>
            <inside-fov first="fido" second="meat"/>
            <inside-fov first="fido" second="barrilPoo"/>
        </inside-fov-info>

        <relations-info>
            <relation name="friend" first="fido" second="meat"/>
            <relation name="friend" first="fido" second="barrilPoo"/>
            <relation name="curiosity" first="fido" second="barrilPee"/>
            <relation name="curiosity" first="fido" second="water"/>
            <relation name="curiosity" first="fido" second="wynx"/>
            <relation name="curiosity" first="fido" second="stick"/>
            <relation name="curiosity" first="fido" second="petHome"/>
        </relations-info>

        <!-- not needed
        <has-said-info>
            <has-said agent="" message=""/>
        </has-said-info>

        <last-agent-action-info>
            <agent-action agent="" action="">
                <param value=""/>
            </agent-action>
        </last-agent-action-info>

        <last-pet-schema-info>
            <pet-schema schema="" result="">
                <param value=""/>
            </pet-schema>
        </last-pet-schema-info>
        -->
    </world-state-info>

</world-definition>
